"text","cmp_code","eu_code"
"Créer des centres publics de déradicalisation et de désendoctrinement sur la base de ce réseau en mettant à contribution leurs intervenants, spécialistes des dérives sectaires, pour mettre en oeuvre des programmes reposant sur un suivi personnalisé et une remise en question cognitive, sentimentale et personnelle.","605.2",NA
"Renforcement de la réserve opérationnelle (RO) : sur le plan des moyens à mettre en oeuvre pourfaire face à la menace terroriste, un effort supplémentaire doit être accompli en matière de réserveopérationnelle.","104",NA
"La réserve opérationnelle permet d’étoffer les effectifs militaires en cas de besoin et deconsolider le lien armée-nation.","104",NA
"La RO fait appel aux anciens militaires d’active (RO 2), mais aussi à despersonnels civils volontaires (RO1).L’effort doit notamment porter sur la possibilité d’un appel effectif à la RO1, impliquant disponibilité, formation et entraînement.","104",NA
"En ce sens des actions devront être prévues en faveur des : salariés (autorisations d’absence, exclusion de pertes de salaires…);","104",NA
"• entreprises (crédit d’impôt RO, partenariat privilégié avec le secteur de la Défense – label « Défense »);","104",NA
"• demandeurs d’emplois (complément de parcours professionnel, prolongation des droits d’allocation) ;","104",NA
"• jeunes et des étudiants en favorisant le volontariat pour des périodes de réserve durant les vacances.","104",NA
"Les missions de la RO doivent être précisément définies, inscrites dans le cadre de la loi de programmationmilitaire et dotées de moyens budgétaires effectivement dédiés.","104",NA
"Des actions de communication en faveur dela RO doivent être engagées.","104",NA
"Un commandement efficace de la réserve opérationnelle doit être assuré.","104",NA
"La Défense Nationale : des moyens renforcés et adaptés","H",NA
"Le budget de la Défense Nationale ne doit pas être une variable d’ajustement de la politique budgétaireet doit être au contraire relevé au niveau nécessaire à notre protection, intérieure comme extérieure.","104",NA
"Pourrait être étudiée, en tant que de besoin, la réduction des moyens d’une dissuasion nucléaire excessivementcoûteuse, alors que l’évolution des menaces, les déploiements nécessaires sur des théâtresd’opérations extérieurs et la lutte contre le terrorisme imposent le relèvement des crédits d’investissementet de fonctionnement affectés aux forces conventionnelles.","105",NA
"Il appartiendra alors à l’Etat-Major desArmées de proposer les arbitrages appropriés entre les composantes sous-marine et aérienne de notreforce de dissuasion.","105",NA
"4 CONQUERIR DE NOUVEAUX DROITS","H",NA
"Artisans inlassables des droits de l’homme et des libertés individuelles, les Radicaux n’entendent pass’en tenir aux seuls progrès à ce jour accomplis sur la voie de l’émancipation.","305.1",NA
"D’autres droits et libertésrestent à conquérir.","201.1",NA
"Avec le PRG, je poursuivrai à cet égard, sur le terrain sociétal comme politique, les objectifs suivants:","305.1",NA
"Avancées sociétales :","H",NA
"Reconnaître le droit de mourir dans la dignité","H",NA
"Ce droit doit pouvoir s’exercer à la demande du malade, placé sous la responsabilité d’un comité d’éthique médicale, lorsqu’il est médicalement prouvé que la maladie est irréversible et la mort proche.","201.1",NA
"Permettre le recours à la Procréation Médicalement Assistée (PMA) à toutes les femmes sans conditions","H",NA
"La PMA doit être accessible à toutes les femmes – par donneur anonyme ou donneur connu – sans discrimination liée à leur situation maritale.","604",NA
"Il faut mettre fin à l’exil procréatif qui pousse nombre de femmes à se rendre à l’étranger pour avoir accès à ces techniques.","604",NA
"Alléger et faciliter les procédures d’adoption pour tous","H",NA
"Les couples, qu’ils soient homosexuels ou non, et les célibataires doivent pouvoir accéder à l’adoption de manière égale et juste, sans discrimination liée à leur orientation sexuelle ou leur condition maritale.","604",NA
"Faire adopter une grande loi sur la bioéthique pour permettre à la médecine de poursuivre ses recherches au service de la santé de tous","H",NA
"L’enjeu est de permettre au progrès scientifique d’ouvrir la voie au traitement d’affections graves et incurables aujourd’hui, comme les maladies neurodégénératives – Alzheimer, Parkinson, sclérose en plaques –, les cancers et les maladies rares.","604",NA
"Légaliser l’usage du cannabis","H",NA
"Pour être pleinement comprise, cette mesure de libéralisation doit être mise en rapport avec la politique de sécurité intérieure (voir ci-dessus).","605.2",NA
"Avancées politiques :","H",NA
"Accorder le droit de vote aux étrangers pour les élections locales et nationales","H",NA
"Reconnu par la Constitution de 1793, admis dans de nombreux pays, le droit de vote des étrangers établissur le territoire national et contribuant par l’impôt au financement des dépenses publiques, exprime sur le terrain des droits politiques la conception humaniste d’une égale dignité des hommes et des femmes.","202.1",NA
"Reconnu pour les élections européenne et municipales aux résidents ayant la nationalité de paysmembres de l’UE, le droit de vote doit être étendu, pour l’ensemble des élections locales et nationalesà tous les étrangers répondant aux conditions mises au droit de vote pour un électeur français (inscriptionsur les listes électorales, conditions d’âge et de capacité juridique), ainsi que, pour les électionsnationales, à une condition de résidence en France d’au moins trois années.","202.1",NA
"5 GARANTIR LES DROITS, LES LIBERTES ET LA PROTECTION DES FEMMES","H",NA
"Certaines des avancées sociétales que nous réclamons, telles que celle concernant le recours à laPMA, correspondent à l’affirmation d’un droit nouveau pour les femmes.","706",NA
"La question des droits et libertésde la femme, celle de l’égalité entre femmes et hommes, ou encore de la protection des femmes,justifient cependant par leur importance une approche spécifique et globale.","503",NA
"Je porterai en conséquence un PROJET POUR LES FEMMES visant à la coordination de l’ensembledes mesures permettant de conduire effectivement à une société de liberté et d’égalité, dans laquelle les femmes trouveront toute leur place.","706",NA
"Droits et libertés des femmes","H",NA
"Sur le terrain des droits de la femme, j’engagerai vigoureusement le combat contre les tentatives et les risques de remise en cause de l’IVG.","604",NA
"A cet effet : je demanderai le renforcement des centres IVG, et le développement des moyens alloués à l’information sur les moyens de contraception,","604",NA
"• je proposerai la reconnaissance d’utilité publique du Planning Familial,","604",NA
"• je m’attacherai à promouvoir un droit européen à l’IVG.","604",NA
"Sur le terrain des libertés des femmes, et de leur rapport à lalaïcité, je rappellerai que celle-ci est, pour les Radicaux, un rempartcontre les obscurantismes mais ne doit pas servir d’alibi à ceux quitentent de stigmatiser telle ou telle religion.","604",NA
"Je veillerai en conséquence à ce que les femmes soient pleinementen mesure d’exercer leur liberté de conscience ou de culture,","607.1",NA
"maisaussi à ce qu’elles ne soient pas entravées par quelque forme quece soit de soumission ou d’oppression qui aurait pour effet de limiterleurs libertés.","201.1",NA
"Egalité femmes-hommes","H",NA
"La timidité des avancées en matière d’égalité femmes-hommes justifie la mise en évidence de cet objectif essentiel par :","503",NA
"• L’identification d’un Ministère des droits des femmes et de l’égalité femmes-hommes","503",NA
"• La création d’une médiation publique autonome en charge des inégalités femmes-hommes, des atteintes aux droits des femmes et des discriminations","503",NA
"La poursuite de l’objectif d’égalité hommes-femmes doit être ensuite activement engagée sur différents terrains.","503",NA
"L’égalité femmes-hommes doit être consacrée sur le terrain des salaires.","503",NA
"Les dispositifs de sanctions financières à l’encontre des discriminations salariales doivent être, sous réserve d’ajustement des barèmes, étendus à toutes les entreprises.","503",NA
"La parité devra également être recherchée au niveau des instances dirigeantes :  des grandes entreprises, d’organismes tels que les fédérations professionnelles, les Chambres consulaires, les agences et opérateurs de l’Etat","503",NA
"Les stéréotypes conduisant à réserver certains métiers, notamment scientifiques ou techniques, aux hommes doivent être combattus, l’accès des femmes à ces métiers devant être encouragé.","503",NA
"L’activité à temps partiel subie par les femmes doit être évitée par des incitations au télétravail et autravail à domicile, tant auprès des entreprises que des administrations.","503",NA
"L’exercice du congé parentalpar les hommes doit être favorisé au moyen d’incitations financières.La conciliation de la vie professionnelle et de la vie familiale doit être favorisée, notamment par:","503",NA
"• L’augmentation des places en crèches, avec des horaires adaptés à la vie professionnelle","504",NA
"• La création de crèches  gardes d’enfants dans les services de la fonction publique et dans les entreprises.","504",NA
"Protection des femmes","H",NA
"La protection des femmes doit être renforcée, par des actions déterminées de:","605.1",NA
"• Lutte contre les violences faites aux femmes.","605.1",NA
"L’objectif doit notamment conduire à l’organisation dans chaque commissariat de préfecture et d’arrondissement d’une structure d’aide aux victimes de violences, assistée d’une association officielle d’aide aux victimes.","605.2",NA
"• Lutte contre le harcèlement.","503",NA
"Devra être notamment mis en place un plan pluriannuel de prévention et d’information sur tous les types de harcèlement.","503",NA
"Bien entendu, la conquête de droits nouveaux, en particulier pour lesfemmes, ne doit pas perdre de vue l’exigence de vigilance au regarddes discriminations persistantes en dépit des prescriptions de laloi, et qui sont notamment fondées sur l’origine ou les croyances.","503",NA
"Les Radicaux restent au premier rang de la lutte contre le racismeet l’antisémitisme et s’appliqueront à débusquer toute forme d’entraveà l’emploi ou au logement qui serait fondée sur les caractéristiquesd’une identité personnelle.","503",NA
"6 DÉFENDRE ET PROMOUVOIR LA LAÏCITÉ","H",NA
"La loi de 1905 sur la séparation des Églises et de l’État est le socle sur lequel repose le principe delaïcité.","604",NA
"Aucune « Charte de la laïcité » ne saurait se substituer à cette loi fondamentale.","604",NA
"Les débats quiont agité notre pays, depuis le début des années 2000, ont montré que le consensus républicain s’estprogressivement délité.","604",NA
"Il est nécessaire de réaffirmer avec force l’attachement de la France à cette loiet à ses principes.","604",NA
"Avec le PRG, je propose en conséquence les mesures suivantes :  L’inscription dans la Constitution des principes posés aux articles 1 et 2 de la loi de 1905","604",NA
"• La création d’une mission interministérielle à la Laïcité","604",NA
"• La mission interministérielle à la laïcité veillera à la défense et à la promotion du principe de laïcité.","604",NA
"Elle remplacera l’Observatoire de la Laïcité.","604",NA
"La mission veillera à ce que la politique éducative, civique et culturelle du Gouvernement tienne compte de tous les aspects de la laïcité, de la liberté de conscience et de l’enseignement concret des principes républicains.","601.1",NA
"La France doit également défendre ce principe républicain au sein des institutions européennes.","601.1",NA
"• La création d’une Maison de la Laïcité dans chaque Région","604",NA
"• L’inscription de la laïcité au patrimoine immatériel de l’humanité de l’UNESCO","604",NA
"Ainsi que les mesures complémentaires suivantes :  sortie graduelle et négociée du régime dérogatoire des cultes en Alsace et en Moselle","604",NA
"• abrogation du délit de blasphème en Alsace-Moselle","604",NA
"• réglementation de la présence des fonctionnaires en service dans les cérémonies religieuses de nature à garantir la neutralité de l’Etat,","604",NA
"• fin de la reconnaissance mutuelle des diplômes entre la France et le Vatican","604",NA
"7 FONDER LA COHESION SOCIALE SUR L’ECOLE DE LA REPUBLIQUE","H",NA
"L’école, service public de la République","H",NA
"La coexistence de plusieurs systèmes éducatifs parallèles est un évident obstacle à la cohésion socialeet contribue à perpétuer ou renforcer les inégalités.","503",NA
"Elle ne saurait s’envisager qu’à des conditions permettantque soient assurées en toutes circonstances les obligations propres au service public éducatif,et ne doit en aucun cas s’apparenter à une concurrence portant atteinte à l’école publique, dont le caractère d’excellence doit être réaffirmé et généralisé.","506",NA
"Je proposerai en conséquence:• La subordination de l’octroi de financements publics à des écoles privées au strict respect par celles-ci des obligations de service public définies par la loi et dans le cadre de contrats conclus avec l’Education Nationale, incluant le respect des programmes définis par celle-ci.","506",NA
"Les financements publics ne seront plus accordés aux établissements qui ne respecteraient pas ces engagements","506",NA
"• La subordination à autorisation administrative de l’ouverture d’écoles ou de lieux d’enseignement ou de formation ne faisant pas appel au financement public.","506",NA
"L’activité de ces établissements, qui devra respecter les principes républicains, devra faire l’objet d’un contrôle systématique","506",NA
"L’école de la République, une école d’excellence","H",NA
"L’école doit permettre aux élèves, toutes filières confondues, de disposer des mêmes chances de réussite et d’épanouissement.","506",NA
"Pour assurer l’excellence de l’Ecole républicaine, je propose: Les mesures générales suivantes: Rendre l’école obligatoire dès 3 ans","506",NA
"Garantir un socle d’enseignement commun jusqu’à 16 ans: le collège unique doit être conservé pour assurer une formation éducative unique jusqu’à 16 ans au moins - ou 15 ans sur dérogation -, âge auquel les enfants pourront s’orienter vers l’apprentissage s’ils le souhaitent.","506",NA
"Aucune sélection ne saurait être effectuée avant","506",NA
"Réduire les effectifs des élèves dans toutes les classes: les professeurs pourront dès lors assurer un meilleur suivi, plus personnalisé, de leurs élèves","506",NA
"En conséquence, augmenter le nombre d’enseignants recrutés et formés chaque année.","506",NA
"L’effort global de recrutement de 60.000 enseignants supplémentaires, engagé mais non encore atteint, doit être poursuivi avec détermination","506",NA
"Renverser une logique d’affectation des enseignants, qui conduit aujourd’hui à l’envoi quasi-systématique des jeunes professeurs dans des établissements défavorisés et souvent difficiles sans avoir l’expérience, la formation ou le bagage nécessaires pour répondre aux défis pédagogiques auxquels ils doivent faire face","506",NA
"Une adaptation des programmes, comportant: • Un renforcement vigoureux de l’acquisition des fondamentaux que sont la lecture, l’écriture (orthographe, grammaire) et les connaissances de base, impliquant toutes vérifications utiles à l’entrée au collège ou à la sortie du primaire.","506",NA
"• Le maintien de l’enseignement du latin et du grec","506",NA
"• La création d’un enseignement commun au lycée en droit, économie et sciences humaines dès la seconde.","506",NA
"• Le recours à l’usage du numérique, sans préjudice de la maîtrise de l’écriture manuelle.","506",NA
"• La recherche, tout au long des années d’études au lycée, de témoignages de professionnels permettant de susciter les vocations et orientations pertinentes.","506",NA
"Une amélioration de l’apprentissage des langues étrangères, par: • La réduction des effectifs des classes de langue, permettant d’insister sur la prise de parole, l’échange et le dialogue entre élèves et professeurs","506",NA
"• L’appel aux laboratoires de langues","506",NA
"• La généralisation de l’usage du numérique","506",NA
"• La démultiplication des échanges scolaires internationaux","506",NA
"La revalorisation, par tous moyens utiles (campagnes de communication, échanges avec les professionnels)des métiers dits « manuels », afin que les élèves qui souhaitent étudier dans le cadre defilières professionnelles puissent le faire par envie et non plus par dépit.","506",NA
"En matière de santé à l’école, je juge indispensable de :• renforcer la santé à l’école en rendant obligatoire une visite médicale annuelle.","504",NA
"• favoriser l’information touchant à la contraception","504",NA
"• sensibiliser les élèves et étudiants aux infections et maladies sexuellement transmissibles et aux pratiques à risques, hétérosexuelles comme homosexuelles.","504",NA
"• favoriser la prévention des addictions.","504",NA
"• lutter contre l’obésité par l’éducation alimentaire.","504",NA
"Une formation des enseignants préservée et améliorée","H",NA
"Je veillerai à ce que : • soit assurée la pérennité de la formation des jeunes enseignants, une formation devant comporter l’acquisition de savoirs nécessaires, mais aussi des méthodes pédagogiques.","704",NA
"• soit organisée une formation des enseignants tout au long de leur carrière.","704",NA
"Par ailleurs, la fragmentation du parcours scolaire rend actuellement les enseignants relativement impuissants pour organiser un accompagnement efficace de l’élève: Développer la bi ou multidisciplinarité lors des formations permettra aux jeunes enseignants de travailler en équipe sur la base de projets pédagogiques adaptés et personnalisés à chacun des élèves.","506",NA
"Enseignement supérieur et recherche","H",NA
"Dans ces domaines, je défendrai une politique éducative tendant à faire de l’Université le lieu privilégié du plus large accès à l’excellence scientifique et professionnelle.","506",NA
"L’université doit être le socle d’une ascension sociale ouverte aux jeunes de toutes origines, fondement du vivre ensemble de demain.","506",NA
"L’université doit pouvoir former efficacement des professionnels.","411",NA
"De nouvelles filières doivent être créées pour entrer en résonance avec les métiers de demain, notamment en ce qui concerne l’écologie et les nouvelles énergies.","411",NA
"Des stages obligatoires doivent être prévus dans toutes les filières, y compris au sein des sciences humaines.","411",NA
"L’objectif de meilleure liaison entre l’Université et le monde professionnel conduit à proposer la suppression de l’obligation d’achever une thèse en trois ans, disposition ayant pour effet pratique d’écarter les professionnels de la recherche et de priver la recherche des apports de connaissance et d’expérience issues de la pratique d’un métier.","411",NA
"De manière générale, j’apporterai le soutien le plus complet à la recherche publique, y compris dans le domaine des sciences humaines et sociales, incluant un soutien aux innovations sociétales.","411",NA
"Je propose également de :  Décentraliser les concours des grandes écoles au sein de tous les lycées de France.","506",NA
"Cette mesure permettrait à tous les élèves de pouvoir se familiariser avec ces concours et de les passer en même temps que leur classe d’âge.","506",NA
"• Renforcer et rationaliser le système de bourse, dans le sens d’une meilleure justice.","506",NA
"D’un point de vue pratique, les universités devraient accorder aux étudiants une plus grande flexibilité dans l’organisation de leur emploi du temps.","506",NA
"La possibilité de suivre des cours du soir ou des cours à distance doit être donnée à ceux qui travaillent en parallèle ou sont en reprise d’étude.","506",NA
"Un apprentissage revalorisé.","H",NA
"L’apprentissage doit être revalorisé et favorisé, notamment part :","504",NA
"une meilleure diffusion des dispositifs d’aide au recrutementd’apprentis (crédit d’impôt apprentissage, exonérations decotisations, aides régionales)","504",NA
"·           2.     un déploiement plus important du programme européend’échanges en matière d’apprentissage (Erasmus +)","506",NA
"Une formation professionnelle plus efficace","H",NA
"Aujourd’hui coûteuse et peu performante, la formation professionnelle, indispensable au retour à unesituation plus satisfaisante de l’emploi, doit être réformée.","411",NA
"Il s’agit d’abord de lui reconnaître de manière générale un caractère de service public, qu’il soit assurépar des organismes publics (AFPA) ou par des organismes privés.","411",NA
"La formation professionnelle assurée par les centres de formation, en conséquence, doit s’exercer, nonsur la base d’un simple agrément, mais dans le cadre d’une délégation de service public, comportantsystématiquement un cahier des charges, assortie d’une obligation de résultats, soumise aucontrôle de fonctionnaires territoriaux.","411",NA
"La loi doit ensuite définir des priorités d’affectation des moyens de la formation professionnelle : luttecontre le chômage, formation des moins qualifiés, reconversion.","411",NA
"Des formations professionnelles décentralisées doivent être organisées au bénéfice des territoires isolés.","411",NA
"8 LA CULTURE, UNE EXIGENCE DE L’HUMANISME REPUBLICAIN","H",NA
"Pour les Radicaux, la culture est une condition nécessaire de l’épanouissement des individus et de leurcapacité à vivre ensemble dans l’échange et le partage.","502",NA
"Les politiques culturelles, nationales ou locales,doivent être promues avec détermination.","502",NA
"Je propose :   • de fixer un objectif de 2%, à atteindre progressivement, pour la part du budget nationalconsacrée à la culture (1,1% aujourd’hui) et aux activités culturelles, en France comme àl’étranger (centres culturels, bibliothèques françaises, etc.).","502",NA
"• de favoriser l’émergence de lieux de culture et d’incubateurs culturels, en proposant desespaces communs, durables ou éphémères, aux artistes locaux et méconnus pour leur permettrede gagner en visibilité et de faire vivre la culture à l’échelon local.","502",NA
"• de développer les oeuvres partagées qui permettent aux habitants de créer avec des artisteslocaux, de désacraliser l’oeuvre artistique et d’améliorer le cadre de vie des habitants.","502",NA
"• de diversifier les sources de financement des évènements culturels, musicaux et artistiques.","502",NA
"• d’ouvrir les bibliothèques et médiathèques publiques le dimanche.","502",NA
"Les bibliothèques etmédiathèques sont actuellement saturées.","502",NA
"L’ouverture dominicale des bibliothèques universitaires,des bibliothèques, médiathèques et des lieux culturels en général constitue une nécessité,notamment pour les étudiants.","502",NA
"9 DES PRIORITES SPECIFIQUES POUR LES OUTRE-MER","H",NA
"Les problématiques d’évolution institutionnelle pouvant et devant être abordées dans le cadre desdispositions prévues par la Constitution, tant pour les collectivités régies par l’article 73 (départementsd’outre-mer et collectivités assimilées) que pour celles régies par l’article 74, et celles prévues pourla Nouvelle-Calédonie,","303",NA
"les priorités pour l’Outre-mer résultent du constat préoccupant de situationscommunément caractérisées par l’insécurité, un taux de chômage exceptionnellement élevé, et l’insuffisancedes moyens d’un développement économique autocentré.","706",NA
"La sécurité","H",NA
"La sécurité des personnes et des biens est, pour la plupart des collectivités d’outre-mer confrontées àdes niveaux de délinquance grave inacceptables, une priorité absolue.","605.1",NA
"Elle doit être assurée par: • Un renforcement très significatif des moyens de police, de gendarmerie, de douane, de contrôleaux frontières, de justice et d’administration pénitentiaire","605.1",NA
"• Une impulsion spécifique donnée, outre-mer, au dispositif de réserve opérationnelle, militaire etcivile, de nature à renforcer les moyens de sécurité fondés sur le recours à des personnels locaux.","104",NA
"L’emploi","H",NA
"Le taux de chômage constaté dans les collectivités d’outre-mer, atteignant ou dépassant en règlegénérale 25%, et davantage auprès des jeunes, ne peut être toléré.","701",NA
"Les mesures pour y remédierdépendent pour partie du cadre statutaire propre à chaque collectivité, et doivent lui être adaptées.","701",NA
"Pour les collectivités régies par l’article 73 de la Constitution (DOM et assimilés), l’action de l’Étatest déterminante et doit comporter les mesures les plus résolues, principalement en matière de soutienà l’activité et à l’emploi par les entreprises.","701",NA
