"text","cmp_code","eu_code"
"Ce soutien doit comporter :   • L’application pleine et entière des dispositions générales en matière de charges sociales desentreprises (suppression complète des cotisations à la branche famille), comme de chargesfiscales (taux d’impôt sur les sociétés ramenés à 10, 15 ou 20%)","402",NA
"• Un allègement supplémentaire très significatif des charges sociales restant à la chargedes entreprises (renforcement et simplification du dispositif LODEOM)","402",NA
"• Participation des collectivités au financement de ces mesures, sur la base de transferts limitésde compétence en matière d’octroi de mer (dont le caractère d’imposition intérieure serarenforcé par son extension aux services) et de TVA (part transférée à la collectivité)","301",NA
"• Un renforcement spécifique du « Plan TPE » : les moyens permettant le développement, outre-mer,des dispositifs « SMA » et « réserve opérationnelle civile », devront être dégagés.","403",NA
"Pour les collectivités régies par l’article 74 et la Nouvelle Calédonie, le soutien à l’emploi assuré parles autorités locales doit être complété par des mesures d’État, comportant notamment le maintien etle renforcement des dispositifs d’aide fiscale à l’investissement dans ces collectivités.","601.1",NA
"Dans le cas particulier de Saint-Martin, où se combinent compétence locale et compétence d’État, l’État doit veiller à la pleine application des mesures d’allègement de charges sociales.","402",NA
"Il doit en outre assumersa responsabilité en matière de transfert de ressources correspondant aux transferts de charge,en restituant à la collectivité les moyens financiers dont elle a été privée : en charge de l’application etdu contrôle des impôts décidés par la collectivité, l’État doit rétablir, pour les impôts directs, la garantiede recettes correspondant aux rôles émis.","301",NA
"Le développement économique autocentré","H",NA
"Le renforcement des capacités de développement fondées sur la mise en oeuvre de ressources localesdoit être beaucoup plus activement recherché.","408",NA
"Il doit comporter un soutien résolu, de niveau nationalcomme, le cas échéant, européen, aux axes de développement suivants :","408",NA
"• développement des énergies renouvelables (éolien, solaire, géothermie), l’objectif devant être, àterme rapproché, l’autosuffisance de chacune des collectivités d’outre-mer","501",NA
"• soutien aux productions agricoles et agro-industrielles traditionnelles d’exportation (banane,canne, rhum)","703.1",NA
"• développement des productions agricoles vivrières, des filières biologiques, de la pêche, comportantla fixation d’objectifs en termes de satisfaction des besoins de consommation extérieurecomme d’exportation (produits naturels ou transformés)","703.1",NA
"• développement de la croissance bleue, par la mise en valeur du considérable potentiel représentépar les espaces marins (domaine, zee)","416.2",NA
"• soutien à l’industrie touristique","408",NA
"• aide fiscale aux investissements dans tous les secteurs productifs","402",NA
"• soutien à l’économie numérique et d’abord, généralisation accélérée de l’accès aux réseaux","411",NA
"• télémédecine : Développement de la E-santé","411",NA
"La lutte contre la vie chère doit prendre appui sur un dispositif spécifique de contrôle des marges derevente sur les produits importés.","412",NA
"III. UNE EUROPE QUI PROTÈGE","H",NA
"Le Brexit, la crise des réfugiés, la résurgence de réflexes de repli national et d’autoritarisme dans certainspays de l’Europe centrale et orientale, mais plus généralement la montée des populismes et dessouverainismes dans beaucoup des États membres de l’Union européenne témoignent d’un recul del’espérance européenne.","108",NA
"Certaines des institutions de l’Union sont décriées, leur action est rendue responsable des difficultésaffectant nos agriculteurs, nos pêcheurs, nos entreprises, nos travailleurs ou nos territoires.","108",NA
"En mêmetemps qu’ils réclament volontiers davantage d’efficacité dans l’action commune de l’Union, la plupartde ses gouvernements s’opposent en pratique aux mesures de fédéralisation qui permettraient d’y parvenir.","108",NA
"La crise de l’Europe atteint les citoyens, dont le scepticisme à l’égard de la construction européennes’est accru, quand ils n’y sont pas – pour une minorité d’entre eux – franchement hostiles.","108",NA
"Elle atteintles gouvernants, incapables de s’accorder sur les procédures et les choix qui seraient ceux d’une Europeunie et efficace.","305.1",NA
"Pourtant, l’Europe est nécessaire.","108",NA
"Elle est nécessaire à la paix, qu’elle a su garantir depuis plusd’un demi-siècle.","106",NA
"Elle est nécessaire pour faire face au risque nouveau du terrorisme, comme auxdéfis que posent les mouvements de population massifs notamment dus aux conflits extérieurs.","605.1",NA
"Elle estévidemment indispensable à la maîtrise de phénomènes tels que les dérèglements du climat, la dégradationglobale de notre environnement, ou encore les risques épidémiques que n’arrête nulle frontière.","501",NA
"L’Europe seule peut en outre, sur le plan de l’économie, du commerce et de la monnaie, se mesurer àarmes égales avec les grandes puissances, désormais plus nombreuses, que compte la planète.","108",NA
"Je suis pour ma part convaincue de la nécessité d’une réponse européenne aux problèmes de notretemps.","108",NA
"Mais au-delà d’un constat qui devrait s’imposer à tous, je porte aussi, avec les Radicaux,un projet européen qui n’est pas seulement utilitaire.","305.1",NA
"Je crois en une construction européenne qui nesoit pas seulement celle d’un marché unique.","108",NA
"Mais qui soit aussi celle d’un espace de solidarité, d’unprogrès de l’humanisme, d’une conquête constamment renouvelée du droit et des libertés, d’un reculdes arbitraires et des intolérances, de la reconnaissance d’une histoire et d’une culture riches et diverses;","201.1",NA
"d’une société prête à s’ouvrir à d’autres pour construire un vivre ensemble où seront garantis,à l’abri des replis communautaristes de tous ordres, l’épanouissement de l’individu et le progrès social.","606.1",NA
"Je demeurerai fidèle à tous les engagements européens des radicaux, et de ceux qui partagent leuridéal.","108",NA
"Celui d’une véritable Europe fédérale, fondée sur une Constitution des États-Unis d’Europe, comportantun véritable gouvernement démocratique européen, un véritable budget fédéral, une harmonisationfiscale et sociale, une politique étrangère et une défense communes.","108",NA
"Je n’ignore pas pour autant que le chemin dans cette direction est long et difficile, semé d’embûches,marqué d’avancées, mais aussi de reculs.","108",NA
"Il est clair que les jours d’aujourd’hui ne sont pas les meilleursque la construction européenne a connus.","108",NA
"Il nous faut donc, après avoir réaffirmé nos convictions et nos engagements, rechercher patiemmentmais résolument les voies et moyens d’un nouvel élan pour l’Europe ; identifier tous les lieux oùla construction européenne devrait, et pourrait, être relancée, en prescrire les moyens.","108",NA
"Mais il nous faut aussi convaincre, contribuer à donner à nos citoyens, comme à ceux des autres paysmembres de l’Union ou qui pourraient la rejoindre, le goût de l’Europe, le désir d’Europe.","108",NA
"Pour cela,l’Europe doit être certes réorganisée, mais aussi mieux comprise, plus proche des citoyens, mieux reconnuedans ses interventions utiles et bénéfiques.","202.1",NA
"Mon programme pour l’Europe comporte ainsi :  • L’indication de quelques-unes des mesures permettant la relance d’une construction européenneplus efficace","108",NA
"• La proposition d’une mesure nationale visant à rapprocher l’Europe des citoyens, et d’en relancerla construction, non plus seulement par le niveau centralisé des États, mais aussi par celuides territoires, au plus près des citoyens.","301",NA
"RELANCER LA CONSTRUCTION EUROPEENNE","H",NA
"Par la création d’un gouvernement économique de la zone euro","H",NA
"Je suis en faveur d’un nouveau traité européen qui viendrait refonder la gouvernance de l’Union,la rendre à la fois plus démocratique et plus efficace.","204",NA
"Notamment par la transformation de la Commissionen un véritable gouvernement de l’Europe, constitué sur la base d’un accord de coalition, responsabledevant le Parlement européen, dont les pouvoirs de contrôle seraient renforcés.","202.1",NA
"De même suis-je favorableà un budget européen plus étoffé, alimenté par des ressources propres plus substantielles.","108",NA
"Dans l’attente de tels progrès vers la démocratie européenne, et sans qu’il soit besoin d’en passer parla procédure longue et hasardeuse de la révision des traités existants, peut être obtenue la constitutiond’un gouvernement économique de la zone euro.","202.1",NA
"Venant utilement compléter, et balancer, le gouvernement monétaire exercé par la Banque CentraleEuropéenne, un gouvernement économique de la zone euro, qu’il est aisé de constituer par simplesdispositions pratiques entre les gouvernements des États qui la forment, jouerait un rôle essentiel enmatière de cohérence des politiques économiques et budgétaires de ces États, et serait le moteur d’initiativesde portée plus générale, notamment en matière d’harmonisation fiscale, ou même de premierséléments d’un budget et d’une fiscalité communs.","409",NA
"Afin de conférer une meilleure dimension démocratique au gouvernement de la zone euro, pourrait s’organiser,à échéances régulières, la réunion des membres du Parlement européen représentant les paysde la zone euro, disposants (hors dispositions d’un nouveau traité) de capacités d’information et d’avis.","202.1",NA
"Par les coopérations renforcées","H",NA
"Les avancées vers davantage de politiques communes, et pour une harmonisation plus complète dansles domaines de la fiscalité ou de la protection sociale, se heurtent à des règles de prises de décisionqui, souvent, les rendent inaccessibles.","108",NA
"Il en est ainsi de l’harmonisation des fiscalités directes, quirequiert l’unanimité.","108",NA
"Les coopérations renforcées entre États volontaires sont en revanche possibles.","108",NA
"Il faut y recourir.","108",NA
"Notammenten matière fiscale, où doit être prioritairement recherchée l’harmonisation de la fiscalité dessociétés, sur le modèle « ACCIS » proposé par la Commission, compatible avec nos propositions enmatière de fiscalité des sociétés au plan national.","108",NA
"L’amorce de coopérations renforcées sur le terrain de l’harmonisation des niveaux de rémunérationsalariale et de la protection sociale doit être également engagée.","701",NA
"Jusqu’à l’obtention d’un degré suffisantd’harmonisation sociale, la protection des salariés et de l’emploi au niveau national doit êtreassurée, notamment par l’adaptation de la directive sur les travailleurs détachés.","701",NA
"Par l’édification d’une Europe de la défense et de la sécurité","H",NA
"La menace terroriste, qui vise toutes les démocraties européennes, les positions affichées par le nouveauPrésident des Etats-Unis, qui font craindre une moindre détermination américaine à protéger l’Europe,favorisent la prise de conscience de l’intérêt, pour les Etats européens, d’avancer beaucoup plusrésolument sur la voie d’une politique européenne de défense et de sécurité.","104",NA
"De premières avancées sont indispensables en matière de renseignement, de coopération anti-terroriste,de gestion commune des frontières extérieures.","605.1",NA
"Des coopérations renforcées doivent être recherchées avec d’autres acteurs potentiels de la défensede l’Europe (Allemagne, Espagne, etc.).","104",NA
"Une prise en compte par les institutions européennes de l’effort spécifique accompli par la Franceau profit de la défense de tous les pays membres doit être demandée.","104",NA
"Tendant à ce qu’une part descrédits d’investissement et de fonctionnement des armées puisse être déduite de l’évaluation du soldebudgétaire au regard des critères du pacte de stabilité et de croissance.","414",NA
"Par la définition d’un droit d’asile européen et d’une politique migratoire commune","H",NA
"Droit d’asile européen","H",NA
"Un droit d’asile européen clair et cohérent doit être défini.","201.2",NA
"Au-delà des quelques éléments déjà mis enplace (dispositif de sauvetage en mer, de surveillance de certaines zones maritimes), il est nécessaire de :","201.2",NA
"• persister dans la voie d’un mécanisme de solidarité intra-européenne fondé sur une répartitionobligatoire des demandeurs d’asile entre les États membres","201.2",NA
"• d’encourager les efforts de l’ensemble des États membres en matière de réinstallation, en demandantla délivrance de visas humanitaires dans les ambassades ou consulats des Étatsmembres dans les pays tiers et en insistant sur la nécessité d’une approche holistique enmatière de migrations qui prennent en compte tous les aspects de la migration, y compris lamigration économique et climatique","201.2",NA
"• de responsabiliser tous les États membres en vue de la transposition pleine et entière des instrumentsdu régime d’asile européen commun pour que les demandes d’asile reçoivent untraitement équivalent quel que soit le pays d’accueil dans l’Union","201.2",NA
"• de soutenir les actions de coopération permettant aux pays tiers de renforcer leurs capacités enmatière d’asile et de promouvoir les politiques de développement","201.2",NA
"Politique migratoire européenne","H",NA
"La définition et la mise en oeuvre d’une politique migratoire commune pour l’ensemble de l’Union européenne devront être recherchées.","602.2",NA
"Par la recherche d’une préférence européenne","H",NA
"Aux premiers pas de la construction européenne étaient mises en oeuvre desdispositions assurant une « préférence communautaire » aux productionsdes Etats membres de la CEE.","406",NA
"A l’heure où, après une période delibéralisation insuffisamment contrôlée des échanges commerciaux internationaux,se profilent des vues protectionnistes, le moment paraît venud’avancer la proposition d’une « préférence européenne » pour les productionsdes Etats membres de l’Union.","406",NA
"Fondée sur l’appel à des critères sociaux et environnementaux, la « préférenceeuropéenne » contribuerait à la protection de nos industries à l’égardd’importations favorisées par des conditions de production compatiblesavec le respect de normes sociales et environnementales satisfaisantes.","416.2",NA
"Elle favoriserait également, par un meilleur respect de ces normes,l’amélioration des conditions de travail dans les pays producteurs et un pluslarge respect des objectifs de protection de l’environnement.","403",NA
"RAPPROCHER L’EUROPE DES CITOYENS","H",NA
"L’apport des politiques européennes aux citoyens et aux territoires doit être plus clairement perçu,expliqué, justifié.","108",NA
"Un tel effet de rapprochement entre l’Europe et les citoyens peut être grandementfavorisé, en France, par la réforme du mode d’élection des représentants au Parlement européen.","202.1",NA
"Je propose que les députés européens soient élus, au scrutin proportionnel, dans des circonscriptionscorrespondant aux actuelles grandes régions.","202.1",NA
"Cette réforme aura pour prolongement naturel d’inviter les députés européens à rendre compte deleur mandat, une fois par an, devant les conseils régionaux.","202.1",NA
"Cet échange serait l’évidente occasionde faire apparaître, non seulement l’efficacité des élus au bénéfice de leurs électeurs, mais, plus généralement,l’intérêt, pour chacune des régions, des interventions de l’Europe.","202.1",NA
"Un tel lien privilégié entre l’Europe et les grandes régions trouve toute sa justification dans lesresponsabilités économiques que partagent ces deux échelons de l’action publique.","202.1",NA
"Parallèlement, je défendrai avec vigueur le maintien et le développement des politiques régionalesde l’Union, notamment celles fondées sur les interventions des fonds structurels.","301",NA
"Je m’opposerai àtoute mesure qui tendrait à substituer aux subventions les seules formes d’aide à caractère de prêts.","403",NA
"DANS L’ATTENTE D’UNE POLITIQUE DE RELATIONS EXTERIEURES ET D’UNE DIPLOMATIE EUROPEENNES, QUELLE POLITIQUE ETRANGERE POUR LA FRANCE ?","H",NA
"S’inscrivant, pour l’essentiel, dans le prolongement de la politique étrangère conduite par le PrésidentHollande, la diplomatie française devra continuer d’oeuvrer :","107",NA
"• En faveur de la paix et de la sécurité,","106",NA
"• Contre le terrorisme,","605.1",NA
"• Pour la protection, partout dans le monde, des droits de l’homme et des libertés,","201.2",NA
"• Pour un développement plus égal, par l’aide aux pays moins avancés et la coopération","107",NA
"Le changement du contexte international, la remontée en puissance des nationalismes, des populismeset de l’isolationnisme, obligent toutefois à des inflexions :La politique étrangère de la France devra se montrer plus indépendante à l’égard d’une diplomatieaméricaine hésitante, plus réaliste dans ses rapports avec d’autres puissances.","103.1",NA
"L’autoritarisme et les actions de force unilatérale de la Russie de Vladimir Poutine, ainsi, ne sauraientêtre approuvés.","202.1",NA
"Pour autant, la Russie est une grande nation européenne, avec laquelle le dialogue,même s’il doit être ferme, est indispensable.","107",NA
"L’évolution du régime turc, défavorable à la démocratie et aux libertés, de même, ne peut être considéréeavec faveur.","202.1",NA
"Mais nul ne peut oublier que la Turquie a toujours partagé une histoire commune avecl’Europe, et qu’elle a su, au XX° siècle, se rénover sur la base du principe de laïcité.","108",NA
"Le régime du momentne saurait être confondu avec ce qu’est véritablement la Turquie : une part de l’Europe, appelée àretrouver le chemin du droit et des libertés, par son intégration, le moment venu, à l’Union Européenne.","108",NA
